{
  "$schema": "https://json-schema.org/draft/2020-12/schema",
  "$id": "https://wavevortexmodel.org/schemas/benchmark-catalog-v1.schema.json",
  "title": "WaveVortexModel benchmark catalog v1",
  "type": "object",
  "additionalProperties": false,
  "required": ["schemaVersion", "scoringReferences", "publishedDatasets"],
  "properties": {
    "schemaVersion": {"const": "benchmark-catalog-v1"},
    "scoringReferences": {
      "type": "array",
      "minItems": 3,
      "maxItems": 3,
      "items": {
        "type": "object",
        "additionalProperties": false,
        "required": ["suiteId", "backendId", "rawArtifact"],
        "properties": {
          "suiteId": {"enum": ["core-v1", "scaling-standard-v1", "scaling-large-v1"]},
          "backendId": {"const": "builtin"},
          "rawArtifact": {"$ref": "#/$defs/repositoryPath"}
        }
      }
    },
    "publishedDatasets": {
      "type": "array",
      "items": {
        "type": "object",
        "additionalProperties": false,
        "required": ["datasetId", "artifact"],
        "properties": {
          "datasetId": {"type": "string", "minLength": 1},
          "artifact": {"$ref": "#/$defs/repositoryPath"}
        }
      }
    },
    "interfaceComparisons": {
      "type": "array",
      "items": {
        "type": "object",
        "additionalProperties": false,
        "required": ["datasetId", "artifact"],
        "properties": {
          "datasetId": {"type": "string", "pattern": "^three-interface--[a-z0-9][a-z0-9-]*--[0-9]{8}T[0-9]{6}Z$"},
          "artifact": {"$ref": "#/$defs/repositoryPath"}
        }
      }
    }
  },
  "$defs": {
    "repositoryPath": {
      "type": "string",
      "minLength": 1,
      "pattern": "^(?!/)(?![A-Za-z]:)(?!.*\\\\)(?!.*(?:^|/)\\.\\.(?:/|$))(?!.*//).+$"
    }
  }
}
